Series,S,Years,Season,Episode,Name,Date,Holiday,link,Description,Cover
Modern Family,11,2009–2020,1,15,My Funky Valentine,10-Feb-2010,St. Valentine's Day,https://www.imdb.com/title/tt1583904/?ref_=ttep_ep15,"Jay treats Gloria to a comedy show, Mitchell and Cameron play matchmakers for Manny, and Phil and Claire plan a romantic escape to spice things up.",
Modern Family,11,2009–2020,2,6,Halloween,27-Oct-2010,Halloween,https://www.imdb.com/title/tt1627464/?ref_=ttep_ep6,"The family helps Claire with Halloween, Jay and Manny tease Gloria, and Cameron deals with painful memories during the holiday.",
Modern Family,11,2009–2020,2,14,Bixby's Back,9-Feb-2011,St. Valentine's Day,https://www.imdb.com/title/tt1627448/?ref_=ttep_ep14,"Phil and Claire reenact an old Valentine's Day routine, while Jay plans a surprise dinner for Gloria, and Mitchell and Cameron have a disagreement over Mitchell's assistant's crush. Manny advises Haley about relationships.",
Modern Family,11,2009–2020,3,9,Punkin Chunkin,23-Nov-2011,Thanksgiving,https://www.imdb.com/title/tt2087341/?ref_=ttep_ep9,"Phil feels creatively stifled by Claire, while Mitchell doubts Cameron's ""punkin chunkin"" story. Gloria won't let Jay criticize Manny's Thanksgiving centerpiece, and Haley and Alex have an accident.",
Modern Family,11,2009–2020,3,10,Express Christmas,7-Dec-2011,Christmas,https://www.imdb.com/title/tt2096098/?ref_=ttep_ep10,"The family celebrates ""Express Christmas"" on December 16 when they realize they won't be together on Christmas Day.",
Modern Family,11,2009–2020,4,5,Open House of Horrors,24-Oct-2012,Halloween,https://www.imdb.com/title/tt2393824/?ref_=ttep_ep5,"On Halloween night, Claire tries to spook Phil, Cameron flaunts his weight loss at his party, and Mitchell's falsehood about Lily's mother has consequences.",
Modern Family,11,2009–2020,4,11,New Year's Eve,9-Jan-2013,New Year,https://www.imdb.com/title/tt2586840/?ref_=ttep_ep11,"On New Year's Eve, the family has different plans: Jay plays poker with Billy Dee Williams, Phil and Claire attempt to rekindle their romance, Mitchell and Cameron search for a bar where they fit in, while Haley and Alex babysit.",
Modern Family,11,2009–2020,4,15,Heart Broken,13-Feb-2013,St. Valentine's Day,https://www.imdb.com/title/tt2691640/?ref_=ttep_ep15,"Phil and Claire's Valentine's plans go awry, Jay and Gloria try to be intimate after the baby, and Mitchell has a wild night after drinking at his party.",
Modern Family,11,2009–2020,5,10,The Old Man & the Tree,11-Dec-2013,Christmas,https://www.imdb.com/title/tt3335562/?ref_=ttep_ep10,"Phil and Luke aim for Canada on the elliptical machine, Jay and Manny search for a wild Christmas tree, Gloria is jealous of Claire's mom, and a mix-up puts Cam and Lily with the homeless at Christmas.",
Modern Family,11,2009–2020,6,6,Halloween 3: AwesomeLand,29-Oct-2014,Halloween,https://www.imdb.com/title/tt4132862/?ref_=ttep_ep6,"The family prepares for Halloween: Phil takes over decorating duties, Jay is unhappy with his costume, and Mitchell has a problem in court with a scary stenographer.",
Modern Family,11,2009–2020,6,8,Three Turkeys,19-Nov-2014,Thanksgiving,https://www.imdb.com/title/tt4106068/?ref_=ttep_ep8,"Phil and Luke take on Thanksgiving, but Claire has a backup plan. Jay and Gloria's plans go awry. Cameron struggles to get Lily to wear a dress.",
Modern Family,11,2009–2020,6,14,Valentine's Day 4: Twisted Sister,11-Feb-2015,St. Valentine's Day,https://www.imdb.com/title/tt4389740/?ref_=ttep_ep14,"Claire struggles to come to terms with Phil's attraction to her alter-ego, Juliana, while Gloria's sister makes a move on Jay. Meanwhile, Mitch and Cam try to retrieve a stolen gift for their friend Anders.",
Modern Family,11,2009–2020,7,9,White Christmas,9-Dec-2015,Christmas,https://www.imdb.com/title/tt5209922/?ref_=ttep_ep9,"Gloria plans a ""White Christmas"" for the family, but the weather doesn't cooperate. Jay decides the future of his business, Alex makes a new friend, and Haley and Andy keep their secret romance going.",
Modern Family,11,2009–2020,8,5,Halloween 4: The Revenge of Rod Skyhook,26-Oct-2016,Halloween,https://www.imdb.com/title/tt6074728/?ref_=ttep_ep5,"The Dunphy's prepare for Luke's Halloween party, Cam confronts his Halloween nemesis, and Jay plans to deliver an unforgettable trick at an old enemy's party.",
Modern Family,11,2009–2020,8,7,Thanksgiving Jamboree,16-Nov-2016,Thanksgiving,https://www.imdb.com/title/tt6184702/?ref_=ttep_ep7,"Cameron goes all out for his Thanksgiving celebration, while Hayley opts to spend the holiday with her new boyfriend instead of her family. Jay works on keeping his blood pressure under control, and Alex grows closer to Dwight.",
Modern Family,11,2009–2020,8,9,Snow Ball,14-Dec-2016,Christmas,https://www.imdb.com/title/tt6254222/?ref_=ttep_ep9,"Manny and Luke organize the school's winter dance, but a texting error complicates things. While Gloria, Claire, Mitchell, and Cameron volunteer at the dance, Jay pretends he wants to spend time with Phil to avoid it.",
Modern Family,11,2009–2020,9,5,"It's the Great Pumpkin, Phil Dunphy",25-Oct-2017,Halloween,https://www.imdb.com/title/tt7476576/?ref_=ttep_ep5,"Phil and Claire turn Halloween into an adult holiday, while Mitch confronts Jay about the slow kitchen renovation and Cam oversteps his welcome as a house guest.",
Modern Family,11,2009–2020,9,7,Winner Winner Turkey Dinner,15-Nov-2017,Thanksgiving,https://www.imdb.com/title/tt7569884/?ref_=ttep_ep7,"On Thanksgiving, everyone celebrates their victories while hiding the truth that they all cheated to achieve them.",
Modern Family,11,2009–2020,9,14,Written in the Stars,28-Feb-2018,St. Valentine's Day,https://www.imdb.com/title/tt7781868/?ref_=ttep_ep14,"Mitch and Cam interfere with Luke's date on Valentine's Day, while Jay and Gloria try some role-playing to spice up their love life. Meanwhile, Joe develops a crush on Claire.",
Modern Family,11,2009–2020,10,5,Good Grief,24-Oct-2018,Halloween,https://www.imdb.com/title/tt8428526/?ref_=ttep_ep5,"The Dunphy-Pritchett-Tucker family experiences a Halloween full of surprises and unexpected news, with everyone dressed in costumes and enjoying tricks and treats.",
Modern Family,11,2009–2020,10,10,Stuck in a Moment,12-Dec-2018,Christmas,https://www.imdb.com/title/tt8428534/?ref_=ttep_ep10,"Haley plans the perfect time to give her family an unforgettable Christmas gift; Phil borrows the family Christmas tree for a house showing; Jay, Gloria, and Joe handle unexpected holiday guests.",
Modern Family,11,2009–2020,11,5,The Last Halloween,30-Oct-2019,Halloween,https://www.imdb.com/title/tt11022174/?ref_=ttep_ep5,Phil aims to frighten Claire on Halloween; Gloria feels insecure about her age when someone assumes she is Jay's wife; Mitchell and Cameron take Lily to a carnival after she chooses to go to her first Halloween party alone.,
Modern Family,11,2009–2020,11,7,The Last Thanksgiving,20-Nov-2019,Thanksgiving,https://www.imdb.com/title/tt11224340/?ref_=ttep_ep7,Cam and Mitch's friends think they broke up; Haley cooks Thanksgiving dinner; Jay takes Phil and Dylan to fly his model plane.,
Modern Family,11,2009–2020,11,9,The Last Christmas,11-Dec-2019,Christmas,https://www.imdb.com/title/tt11248100/?ref_=ttep_ep9,Mitchell is suspicious of Cameron's intentions for Christmas dinner; Claire avoids Jay's job offer; Luke faces the aftermath of kissing Manny's ex-girlfriend.,
Melrose Place,7,1992–1999,1,18,A Melrose Place Christmas,16-Dec-1992,Christmas,https://www.imdb.com/title/tt0645976/?ref_=ttep_ep18,Alison recovers while Billy becomes overprotective; Jo and Jake deal with her past; Rhonda goes skiing with Terrance; Matt reconciles with his father; Michael invites co-worker Kimberly to the Christmas party.,
Melrose Place,7,1992–1999,2,12,Cold Turkey,24-Nov-1993,Thanksgiving,https://www.imdb.com/title/tt0646007/?ref_=ttep_ep12,"Jake faces an FBI dilemma over illegal car sales. Sydney turns down Lauren's offer but attends her Thanksgiving dinner. Michael recovers from injury, and Kimberly's comatose mother arrives to take her back to Cleveland.",
Melrose Place,7,1992–1999,2,15,Under the Mistletoe,22-Dec-1993,Christmas,https://www.imdb.com/title/tt0646174/?ref_=ttep_ep15,Alison and Billy reconnect on Christmas Eve. Sydney decides to leave her former life behind. Matt hosts a Christmas party for residents as Katya and Nikki leave for Russia.,
Melrose Place,7,1992–1999,3,11,The Days of Wine and Vodka,21-Nov-1994,Thanksgiving,https://www.imdb.com/title/tt0646144/?ref_=ttep_ep11,Alison insults Billy and Susan at Thanksgiving; Jake is extorted and beaten up; Sydney makes a deal with Chris; Kimberly proposes a solution to Jo's custody case; Peter anonymously buys D&D's stock.,
Melrose Place,7,1992–1999,3,15,Holiday on Ice,19-Dec-1994,Christmas,https://www.imdb.com/title/tt0646045/?ref_=ttep_ep15,"Jo gets Matt's help to get her baby back from Michael. Amanda learns a Christmas lesson from Bruce's ghost and breaks up with Peter. Matt ends things with Jeffrey, while Terry supports Alison in rehab.",
Melrose Place,7,1992–1999,3,20,St. Valentine's Day Massacre,13-Feb-1995,St. Valentine's Day,https://www.imdb.com/title/tt0646127/?ref_=ttep_ep20,"Sydney is in a cult and tries to escape, Amanda works during chemotherapy, Kimberly doubts Michael, Billy confides in Alison about Amanda's health, and Matt takes Jo on a photo tour where he beats up a drug dealer.",
Melrose Place,7,1992–1999,4,15,Oy! to the World,11-Dec-1995,Christmas,https://www.imdb.com/title/tt0646101/?ref_=ttep_ep15,"Sydney hosts a holiday fundraiser at Bobby's mansion, Alison relapses into drinking, Michael discovers Kimberly is advising Sydney, and Matt enters into a new relationship.",
Melrose Place,7,1992–1999,5,13,Crazy Love,16-Dec-1996,Christmas,https://www.imdb.com/title/tt0646010/?ref_=ttep_ep13,"Peter catches Amanda with Craig, Jake and Alison's vacation turns into a nightmare, and Sydney meets a millionaire at an art auction.",
Melrose Place,7,1992–1999,6,13,A Tree Talks in Melrose,22-Dec-1997,Christmas,https://www.imdb.com/title/tt0645980/?ref_=ttep_ep13,"Cooper intervenes in Michael's divorce, Jennifer blackmails Lexi, Jon Secada helps save the Jazz Club, Connie tries to break up Samantha and Billy, and Amanda tries to reconcile with Kyle.",
Melrose Place,7,1992–1999,7,19,The Usual Santas,21-Dec-1998,Christmas,https://www.imdb.com/title/tt0646158/?ref_=ttep_ep19,"During Christmas Michael, Peter, Kyle, Ryan, and Lou Visconti are mistakenly arrested on their way to a kids charity fundraiser. Lexi, Amanda, and Eve clear up the misunderstanding.",
Married with Children,11,1987–1997,2,13,You Better Watch Out,20-Dec-1987,Christmas,https://www.imdb.com/title/tt0642437/?ref_=ttep_ep13,"The Bundys' Christmas is disrupted when a Santa Claus who was parachuting crashes into their backyard, attracting the attention of the neighborhood kids.",
Married with Children,11,1987–1997,2,17,"Peggy Loves Al - Yeah, Yeah, Yeah",14-Feb-1988,St. Valentine's Day,https://www.imdb.com/title/tt0642343/?ref_=ttep_ep17,"On Valentine's Day, Kelly gets lots of Valentine's cards, Steve plans a Hawaii trip for Marcy, and Bud waits for his first Valentine. Peggy wants Al to say ""I Love You."" Marcy plans to surprise Steve by jumping out of a cake.",
Married with Children,11,1987–1997,4,11,It's a Bundyful Life Part 1,17-Dec-1989,Christmas,https://www.imdb.com/title/tt0642303/?ref_=ttep_ep11,"Al has saved up money to buy his family Christmas presents, but a late rush of customers at the shoe store prevents him from getting to the bank to retrieve the money he needs.",
Married with Children,11,1987–1997,4,12,It's a Bundyful Life Part 2,17-Dec-1989,Christmas,https://www.imdb.com/title/tt0642304/?ref_=ttep_ep12,"Al's guardian angel visits him to show him what life would be like if he had never been born. The Jablonskys are a perfect family, while the Rhoades are similar to the Bundys, but without Al.",
Married with Children,11,1987–1997,7,12,Christmas,20-Dec-1992,Christmas,https://www.imdb.com/title/tt0642248/?ref_=ttep_ep12,"Al avoids buying gifts for his family by pitting them against each other, but this year they make him take jobs to earn money. Playing Santa at the mall is one of the jobs, where Marcy and Jefferson taunt him.",
Married with Children,11,1987–1997,8,7,"Take My Wife, Please",24-Oct-1993,Halloween,https://www.imdb.com/title/tt0642384/?ref_=ttep_ep7,Peggy dons a Grim Reaper costume and refuses to leave Al until someone in the family asks for him. Marcy throws a party where the Bundys dress up as the Village People to celebrate female spouse murderers.,
Married with Children,11,1987–1997,8,13,The Worst Noel,19-Dec-1993,Christmas,https://www.imdb.com/title/tt0809290/?ref_=ttep_ep13,Kelly and Bud sneak in a jukebox for their arguing parents on Christmas Eve while Marcy and Jefferson throw a party next door without telling Al.,
Married with Children,11,1987–1997,8,17,Valentine's Day Massacre,13-Feb-1994,St. Valentine's Day,https://www.imdb.com/title/tt0642427/?ref_=ttep_ep17,"On Valentine's Day, Al competes with other last-minute shoppers for gifts at a store. Bud searches for his long-lost Valentine, who is now a famous pop star and faces physical and sexual abuse while staying at a hotel.",
Married with Children,11,1987–1997,10,14,I Can't Believe It's Butter,17-Dec-1995,Christmas,https://www.imdb.com/title/tt0642294/?ref_=ttep_ep14,"Griff develops feelings for a phone sex partner named ""Butter"" during Christmas, only to find out that ""Butter"" is actually Peg's mother, which Al eventually discovers.",
Married with Children,11,1987–1997,11,6,A Bundy Thanksgiving,24-Nov-1996,Thanksgiving,https://www.imdb.com/title/tt0642204/?ref_=ttep_ep6,"On Thanksgiving, Al and Griff visit Al's aunt Maddie to buy her famous potato pie, only to find out she has passed away. Meanwhile, Jefferson struggles to find a turkey for Marcy, but Kelly brings home a stray turkey.",
Married with Children,11,1987–1997,11,8,God Help Ye Merry Bundymen,22-Dec-1996,Christmas,https://www.imdb.com/title/tt0642278/?ref_=ttep_ep8,"Al resists getting a Christmas tree, Marcy competes in a decorating contest, and Bud and Kelly kidnap Mary and Joseph from Marcy's Nativity Scene for ransom. Meanwhile, Gary considers replacing Al and Griff at the shoe store.",
Malcolm in the Middle,7,2000–2006,2,2,Halloween Approximately,8-Nov-2000,Halloween,https://www.imdb.com/title/tt0640338/?ref_=ttep_ep2,"Francis is late for Halloween, but he and his brothers still manage to pull off the ultimate prank. Meanwhile, Hal becomes obsessed with catching a speeder and ends up stealing the culprit's car with Lois.",
Malcolm in the Middle,7,2000–2006,3,7,Christmas,16-Dec-2001,Christmas,https://www.imdb.com/title/tt0640302/?ref_=ttep_ep7,"The Wilkerson family Christmas is in chaos as the boys misbehave, and Lois holds Christmas hostage in the garage. Meanwhile, Francis visits his grandmother in Canada, who has no Christmas spirit left.",
Malcolm in the Middle,7,2000–2006,5,4,Thanksgiving,23-Nov-2003,Thanksgiving,https://www.imdb.com/title/tt0640407/?ref_=ttep_ep4,"Reese enlists Hal and Dewey to help with the cooking, and Francis and Piama are at odds. Meanwhile, Malcolm attends a party at Kirsten's house and declares it the best Thanksgiving ever.",
Malcolm in the Middle,7,2000–2006,5,7,Christmas Trees,14-Dec-2003,Christmas,https://www.imdb.com/title/tt0640303/?ref_=ttep_ep7,Hal and the boys compete with the local church over Christmas tree prices during the holiday season.,
Malcolm in the Middle,7,2000–2006,6,6,Hal's Christmas Gift,19-Dec-2004,Christmas,https://www.imdb.com/title/tt0640334/?ref_=ttep_ep6,"Hal and Lois go for handmade Christmas gifts due to their financial situation, but Hal is embarrassed when he sees the boys' high-quality and thoughtful gifts, making him panic about his own shoddy attempt.",
Malcolm in the Middle,7,2000–2006,7,4,Halloween,28-Oct-2005,Halloween,https://www.imdb.com/title/tt0640337/?ref_=ttep_ep4,"Reese and Malcolm learn about a murder that took place in their house and Hal is terrified of ghosts. Meanwhile, Reese and Dewey take Jamie trick or treating and make an enemy, and Lois gets stuck at work because of a shoplifter.",
The Office,9,2005–2013,2,5,Halloween,18-Oct-2005,Halloween,https://www.imdb.com/title/tt0664516/?ref_=ttep_ep5,"Corporate pressure Michael to fire an employee, casting a shadow over the office Halloween party.",
The Office,9,2005–2013,2,10,Christmas Party,6-Dec-2005,Christmas,https://www.imdb.com/title/tt0664513/?ref_=ttep_ep10,"In an effort to save the office Halloween party from boredom, Michael defies corporate policy and buys alcohol for the staff.",
The Office,9,2005–2013,2,16,Valentine's Day,9-Feb-2006,St. Valentine's Day,https://www.imdb.com/title/tt0763221/?ref_=ttep_ep16,"Michael visits Dunder Mifflin corporate headquarters in New York with Jan, and they both get surprised. Scranton office celebrates Valentine's Day in a grade school style.",
The Office,9,2005–2013,3,10,A Benihana Christmas,14-Dec-2006,Christmas,https://www.imdb.com/title/tt0908674/?ref_=ttep_ep10,"Pam and Karen host a rival Christmas party after trouble arises within the party planning committee, but Michael is not interested in celebrating as he was recently dumped by Carol.",
The Office,9,2005–2013,5,10,Moroccan Christmas,11-Dec-2008,Christmas,https://www.imdb.com/title/tt1248733/?ref_=ttep_ep10,"At the office Christmas party, Phyllis blackmails Angela to take over the planning, while Dwight monopolizes a popular Christmas gift. Meredith gets drunk and sets her hair on fire, leading to an intervention from Michael.",
The Office,9,2005–2013,6,13,Secret Santa,10-Dec-2009,Christmas,https://www.imdb.com/title/tt1548747/?ref_=ttep_ep13,"Michael is upset when Jim promises Phyllis the role of office Santa, while bad news from David Wallace threatens to overshadow the Christmas party.",
The Office,9,2005–2013,7,6,Costume Contest,28-Oct-2010,Halloween,https://www.imdb.com/title/tt1725594/?ref_=ttep_ep6,"Halloween at Dunder Mifflin, Michael is upset with Darryl. Jim and Pam try to figure out why Danny didn't call Pam back four years ago.",
The Office,9,2005–2013,7,11,Classy Christmas,9-Dec-2010,Christmas,https://www.imdb.com/title/tt1752584/?ref_=ttep_ep11,"Michael throws a Christmas party to welcome Holly back to the Scranton branch, but is disappointed to learn she still has a boyfriend.",
The Office,9,2005–2013,7,15,PDA,10-Feb-2011,St. Valentine's Day,https://www.imdb.com/title/tt1817006/?ref_=ttep_ep15,"Michael and Holly's PDA annoys the office, Erin solves Gabe's riddles to find her gift from Andy, and Jim and Pam get drunk and try to find a private place in the office.",
The Office,9,2005–2013,8,5,Spooked,27-Oct-2011,Halloween,https://www.imdb.com/title/tt2074990/?ref_=ttep_ep5,"Erin fears she'll be fired after planning a disastrous Halloween party for Robert and his son. Meanwhile, Robert challenges the staff to come up with the perfect spooky story.",
The Office,9,2005–2013,8,10,Christmas Wishes,8-Dec-2011,Christmas,https://www.imdb.com/title/tt2113519/?ref_=ttep_ep10,"Andy tries to fulfill everyone's Christmas wishes, while Robert California drowns his sorrows at the office party",
The Office,9,2005–2013,8,14,Special Project,9-Feb-2012,St. Valentine's Day,https://www.imdb.com/title/tt2190001/?ref_=ttep_ep14,"Andy assigns Dwight to lead a special project in Tallahassee, but Dwight is not pleased with the team Andy has put together. Meanwhile, Darryl is trying to decipher the meaning of Val's Valentine's gift.",
The Office,9,2005–2013,9,5,Here Comes Treble,25-Oct-2012,Halloween,https://www.imdb.com/title/tt2433396/?ref_=ttep_ep5,"Andy hosts the Cornell a Capella group on Halloween, while Dwight discovers that Nellie takes anxiety pills and Pam disapproves of Jim's business decision.",
The Office,9,2005–2013,9,9,Dwight Christmas,6-Dec-2012,Christmas,https://www.imdb.com/title/tt2514850/?ref_=ttep_ep9,Dwight throws a Pennsylvania Dutch Christmas party but ends it early due to Jim's other job. Erin seeks comfort from a co-worker after a disappointing text from Andy.,
The Office,9,2005–2013,9,15,Couples Discount,7-Feb-2013,St. Valentine's Day,https://www.imdb.com/title/tt2572738/?ref_=ttep_ep15,"Andy comes back to a hostile work environment and a furious girlfriend after being gone for three months. Meanwhile, Jim's Valentine's Day plans with Pam don't go according to plan.",
2 Broke Girls,6,2011–2017,1,10,And the Very Christmas Thanksgiving,21-Nov-2011,Christmas,https://www.imdb.com/title/tt2102511/?ref_=ttep_ep10,Caroline and Max work at a department store's Santaland during Caroline's first holiday season without money to earn extra cash.,
2 Broke Girls,6,2011–2017,2,12,And the High Holidays,17-Dec-2012,Christmas,https://www.imdb.com/title/tt2556388/?ref_=ttep_ep12,"Desperate to pay their overdue rent, Max and Caroline turn to a group of shady customers who are willing to pay top dollar for their cupcakes. ",
2 Broke Girls,6,2011–2017,4,7,And a Loan for Christmas,15-Dec-2014,Christmas,https://www.imdb.com/title/tt4116608/?ref_=ttep_ep7,"Max and Caroline secure a bank loan to manufacture their cupcake T-shirts for high-end boutiques, while Sophie convinces the diner crew to dress up for a holiday decorating competition.",
30 Rock,7,2006–2013,1,13,Up All Night,8-Feb-2007,St. Valentine's Day,https://www.imdb.com/title/tt0944245/?ref_=ttep_ep14,"Liz forces staff to work on Valentine's Day, receives mystery flowers. Jack finalizes divorce with Bianca and celebrates with Tracy who is role-playing in a hotel room. Jack brings a hooker there.",
30 Rock,7,2006–2013,2,9,Ludachristmas,13-Dec-2007,Christmas,https://www.imdb.com/title/tt1001594/?ref_=ttep_ep9,"Jack finds solace in the love and support of Liz's parents, while Kenneth disrupts the staff's plans for a wild holiday party.",
30 Rock,7,2006–2013,3,6,Christmas Special,11-Dec-2008,Christmas,https://www.imdb.com/title/tt1248348/?ref_=ttep_ep6,"Jack accidentally hits his mother with his car and is forced to care for her while she recovers. To lift her spirits, he puts on a Christmas special with the help of the staff. Meanwhile, Liz buys toys for a 'Letters to Santa' program as her mother is not hosting a family Christmas.",
30 Rock,7,2006–2013,3,11,St. Valentine's Day,12-Feb-2009,St. Valentine's Day,https://www.imdb.com/title/tt1248332/?ref_=ttep_ep11,"Liz's Valentine's Day doesn't go as planned with Dr. Baird, Elisa drags Jack to church, and Kenneth goes on a date with a blind woman with Tracy's help.",
30 Rock,7,2006–2013,4,8,Secret Santa,10-Dec-2009,Christmas,https://www.imdb.com/title/tt1540153/?ref_=ttep_ep8,"Jack reunites with a former crush from a social networking site, the writers create a fake religion to avoid participating in Secret Santa with Kenneth, and Pete seeks revenge on Jenna for not contributing to a Christmas gift.",
30 Rock,7,2006–2013,4,13,Anna Howard Shaw Day,11-Feb-2010,St. Valentine's Day,https://www.imdb.com/title/tt1590350/?ref_=ttep_ep13,"On Valentine's Day, Liz is stranded after her oral surgery, Jack goes on a date with a journalist, and Jenna confronts her stalker's infidelity.",
30 Rock,7,2006–2013,5,10,Christmas Attack Zone,9-Dec-2010,Christmas,https://www.imdb.com/title/tt1635807/?ref_=ttep_ep10,"Jack invites his father and Avery to Christmas dinner to ambush his mother, Jenna misses her ex on ""New Queers Eve"", and Tracy tries to maintain his new ""serious"" image.",
30 Rock,7,2006–2013,6,6,"Hey, Baby, What's Wrong?: Part 1",9-Feb-2012,St. Valentine's Day,https://www.imdb.com/title/tt2105091/?ref_=ttep_ep6,"Liz and Criss go to IKEA and encounter relationship problems, Jack develops an attraction to his mother-in-law, Kenneth trains his assistant, and Jenna experiences stage fright.",
30 Rock,7,2006–2013,6,7,"Hey, Baby, What's Wrong?: Part 2",9-Feb-2012,St. Valentine's Day,https://www.imdb.com/title/tt2372246/?ref_=ttep_ep7,"Criss and Liz go shopping for a dining room table on Valentine's Day, while Jack spends time with his mother-in-law. Meanwhile, Jenna scrambles to find a replacement producer for her upcoming live performance, and Tracy and Frank help Lutz find a date for Valentine's Day.",
3rd Rock from the Sun,6,1996–2001,2,10,"Gobble, Gobble, Dick, Dick",24-Nov-1996,Thanksgiving,https://www.imdb.com/title/tt0502676/?ref_=ttep_ep10,"The Solomons, unfamiliar with the concept of Thanksgiving, receive help from Mrs. Dubcek and her daughter Vicky to celebrate the holiday.",
3rd Rock from the Sun,6,1996–2001,2,12,Jolly Old St. Dick,15-Dec-1996,Christmas,https://www.imdb.com/title/tt0502688/?ref_=ttep_ep12,"In their first Christmas on Earth, the Solomons try to understand the holiday traditions and gift-giving, while Dick struggles to find the perfect gift for Mary.",
3rd Rock from the Sun,6,1996–2001,4,9,Happy New Dick!,15-Dec-1998,New Year,https://www.imdb.com/title/tt0502680/?ref_=ttep_ep9,"Tommy throws a New Year's Eve party at the bar where Harry is employed, but Dick is feeling unaccomplished and unsure about his past year.",
3rd Rock from the Sun,6,1996–2001,5,11,Dick Puts the 'Id' in Cupid,8-Feb-2000,St. Valentine's Day,https://www.imdb.com/title/tt0502639/?ref_=ttep_ep11,Dick becomes insecure after discovering that Mary has been discussing their relationship with a therapist.,
3rd Rock from the Sun,6,1996–2001,6,2,Fear and Loathing in Rutherford,31-Oct-2000,Halloween,https://www.imdb.com/title/tt0502667/?ref_=tt_mv_close,Sally and Harry attempt to assist Tommy in getting over his lost love.,
