Series,S,Years,Season,Episode,Name,Date,Holiday,link,Description,Cover
Caroline in the City,4,1995–1999,2,11,Caroline and the Freight King,17-Dec-1996,Christmas,https://www.imdb.com/title/tt0536760/?ref_=ttep_ep11,"Caroline gets locked in the laundry with a homeless man, Del hires a stripper-gram as a receptionist, and Charlie becomes jealous. Meanwhile, Richard tries to break up with Shelly.",
Caroline in the City,4,1995–1999,3,11,Caroline and the Used Car Salesman,8-Dec-1997,Christmas,https://www.imdb.com/title/tt0536806/?ref_=ttep_ep11,"Caroline's family visits for Christmas and Richard gets a second job as a car salesman, causing rumors of infidelity.",
Caroline in the City,4,1995–1999,3,12,Caroline and the Decanter,15-Dec-1997,Christmas,https://www.imdb.com/title/tt0536750/?ref_=ttep_ep12,"Richard and Julia's belated honeymoon in Hawaii is ruined when they get snowed in. Caroline has an unpleasant Christmas dinner with the Cassidys, while Charlie's father pays him a visit.",
Caroline in the City,4,1995–1999,4,5,Caroline and the First Date,26-Oct-1998,Halloween,https://www.imdb.com/title/tt1099339/?ref_=ttep_ep5,"Del is tasked with organizing the firm's Halloween party, but fears it may lead to him getting fired. Meanwhile, Caroline and Richard have their first date, but struggle to agree on what to do.",
Caroline in the City,4,1995–1999,4,11,Caroline and the Fright Before Christmas,21-Dec-1998,Christmas,https://www.imdb.com/title/tt0536761/?ref_=ttep_ep11,"Caroline becomes disillusioned with the commercialism of Christmas, leading the gang to try and change her mind. However, their plans don't quite go as expected.",
The Jamie Foxx Show,5,1996–2001,1,8,Kiss & Tell,30-Oct-1996,Halloween,https://www.imdb.com/title/tt0614365/?ref_=ttep_ep8,Jamie mistakenly assumes that Fancy is his date at a Halloween masquerade party.,
The Jamie Foxx Show,5,1996–2001,1,12,A Thanksgiving to Remember,27-Nov-1996,Thanksgiving,https://www.imdb.com/title/tt0614316/?ref_=ttep_ep12,Jamie and friends' failed promotion teaches them the importance of gratitude.,
The Jamie Foxx Show,5,1996–2001,2,7,Misery Loves Company,26-Oct-1997,Halloween,https://www.imdb.com/title/tt0614369/?ref_=ttep_ep7,"On Halloween, Jamie is propositioned by a hotel guest who wants him to be her eternal husband. Junior and Helen have an unexpected experience at a lovers' retreat.",
The Jamie Foxx Show,5,1996–2001,3,10,Christmas Day-Ja Vu,17-Dec-1998,Christmas,https://www.imdb.com/title/tt0614329/?ref_=ttep_ep10,Jamie experiences a Christmas Eve time loop and gains a new appreciation for the holiday's true meaning.,
The Jeffersons,11,1975–1985,3,12,The Christmas Wedding,22-Dec-1976,Christmas,https://www.imdb.com/title/tt0614968/?ref_=ttep_ep12,"Lionel and Jenny's Christmas wedding plans face opposition from George, who disapproves of their minister's religious denomination and skin color.",
The Jeffersons,11,1975–1985,4,15,"984 W. 124th Street, Apt. 5C",24-Dec-1977,Christmas,https://www.imdb.com/title/tt0614792/?ref_=ttep_ep15,Louise discovers George has been making monthly payments to an address in Harlem.,
The Jeffersons,11,1975–1985,5,12,George Finds a Father,20-Dec-1978,Christmas,https://www.imdb.com/title/tt0614845/?ref_=ttep_ep12,"During the Christmas holiday, George learns a disturbing secret about his mother from his guardian.",
The Jeffersons,11,1975–1985,6,4,"Now You See It, Now You Don't: Part 1",21-Oct-1979,Halloween,https://www.imdb.com/title/tt0614940/?ref_=ttep_ep4,"On Halloween night, Louise witnesses a man dressed as a rabbit committing murder, turning the evening of dressing up as movie stars into a night of terror.",
The Jeffersons,11,1975–1985,6,5,"Now You See It, Now You Don't: Part 2",28-Oct-1979,Halloween,https://www.imdb.com/title/tt0614941/?ref_=tt_mv_close,"George and friends wait for the costume contest at the bar, but Louise confronts the killer rabbit in her apartment, becoming his next target.",
The Jeffersons,11,1975–1985,7,8,All I Want for Christmas,21-Dec-1980,Christmas,https://www.imdb.com/title/tt0614807/?ref_=ttep_ep8,"George, dressed as Santa Claus at the Help Center, makes a promise to ten-year-old orphan Billy to fulfill his Christmas wish for a pair of parents.",
The Jeffersons,11,1975–1985,10,10,Father Christmas,11-Dec-1983,Christmas,https://www.imdb.com/title/tt0614833/?ref_=ttep_ep10,"Louise, Helen and Bentley go caroling while George and Tom decline, saying it's for women. George and Tom bond over Christmas stories about their fathers.",
Joey,2,2004–2006,1,12,Joey and the Plot Twist,9-Dec-2004,Christmas,https://www.imdb.com/title/tt0616310/?ref_=ttep_ep12,"Joey struggles to get into the Christmas spirit in California, while Gina has given up on Christmas since her son Michael lost Christmas faith at age three. Meanwhile, on his new show ""Powder Deep,"" Joey's character may be killed off after he upsets the obsessive producer.",
Joey,2,2004–2006,1,17,Joey and the Valentine's Date,10-Feb-2005,St. Valentine's Day,https://www.imdb.com/title/tt0616323/?ref_=ttep_ep17,Joey mistakenly leads a reporter to believe he's serious about a Valentine's Day flirtation to secure a good review in People Magazine.,
Joey,2,2004–2006,2,10,Joey and the Bachelor Thanksgiving,24-Nov-2005,Thanksgiving,https://www.imdb.com/title/tt0616290/?ref_=ttep_ep10,"Joey's plans to show his finished villa to Alex are ruined when Gina takes over for a Thanksgiving decoration frenzy. Meanwhile, Joey is charmed by his party-loving neighbor Dean, and Zach and Joey must retrieve donated archaeological artifacts from a poor family.",
Joey,2,2004–2006,2,13,Joey and the Christmas Party,15-Dec-2005,Christmas,https://www.imdb.com/title/tt0616296/?ref_=ttep_ep13,"Joey struggles to resist his attraction to Alex while throwing a Christmas party with plenty of young, desirable guests. Meanwhile, Bobbie deals with an overbearing British man and Michael and Zack struggle to impress girls.",
Just Shoot Me!,7,1997–2003,2,9,"Jesus, It's Christmas",16-Dec-1997,Christmas,https://www.imdb.com/title/tt0617920/?ref_=ttep_ep9,"Maya suggests pooling Christmas money to give to someone in need, but is stunned when janitor Jesus uses the money to buy her lavish gifts. Finch steals a camera lens to get invited to a swimsuit shoot.",
Just Shoot Me!,7,1997–2003,3,3,The Mask,27-Oct-1998,Halloween,https://www.imdb.com/title/tt0617986/?ref_=ttep_ep3,"Finch thinks Nina has an imaginary alter ego, while Maya learns Jack deceived her on Halloween years ago.",
Just Shoot Me!,7,1997–2003,3,10,How the Finch Stole Christmas,15-Dec-1998,Christmas,https://www.imdb.com/title/tt0617913/?ref_=ttep_ep10,Finch is disappointed with his Christmas present and decides to swap everyone's presents with lame objects in retaliation.,
Just Shoot Me!,7,1997–2003,5,7,The First Thanksgiving,23-Nov-2000,Thanksgiving,https://www.imdb.com/title/tt0617978/?ref_=ttep_ep7,Thanksgiving at Jack's country house.,
Just Shoot Me!,7,1997–2003,6,9,Christmas? Christmas!,13-Dec-2001,Christmas,https://www.imdb.com/title/tt0617882/?ref_=ttep_ep9,"Jack's daughter Hannah causes a scene while waiting to see Santa, and Jack must intervene. Maya meets a celebrity who shares her love for Christmas, but takes it to an extreme level.",
Just Shoot Me!,7,1997–2003,7,4,Halloween? Halloween!,29-Oct-2002,Halloween,https://www.imdb.com/title/tt0617907/?ref_=ttep_ep4,"Blush team attends Nina's A-list Halloween party, where Jack and Finch compete for the attention of a model. Maya helps Elliott realize his true feelings for Vicky, Nina becomes jealous of her new boyfriend's past lovers.",
Kate & Allie,6,1984–1989,2,11,New Year's Eve,31-Dec-1984,New Year,https://www.imdb.com/title/tt0793934/?ref_=ttep_ep11,"Kate and Allie search for New Year's Eve plans, hoping to avoid spending the night alone at home.",
Kate & Allie,6,1984–1989,3,8,Thanksgiving,25-Nov-1985,Thanksgiving,https://www.imdb.com/title/tt0618760/?ref_=ttep_ep8,"Allie hosts Thanksgiving with Charles' new wife Claire, but guests cancel and Charles is called to work, leaving Allie and Claire to bond.",
Kate & Allie,6,1984–1989,4,6,Halloween II,27-Oct-1986,Halloween,https://www.imdb.com/title/tt0618721/?ref_=ttep_ep6,Kate and Allie accidentally bring home a man and his ex-wife's ghost on Halloween night after attending a parade.,
Kate & Allie,6,1984–1989,5,12,The Nightmare Before Christmas,14-Dec-1987,Christmas,https://www.imdb.com/title/tt0618774/?ref_=ttep_ep12,The family swaps traditional Christmas for a ski trip and offers to be helper elves for others' holiday celebrations.,
The King of Queens,9,1998–2007,1,10,Supermarket Story,23-Nov-1998,Thanksgiving,https://www.imdb.com/title/tt0620161/?ref_=ttep_ep10,"Doug, Carrie, and Arthur have an eventful day grocery shopping for Thanksgiving.",
The King of Queens,9,1998–2007,1,11,Noel Cowards,14-Dec-1998,Christmas,https://www.imdb.com/title/tt0620117/?ref_=ttep_ep11,"During the Christmas season, Doug and Carrie dream of buying a new car but realize they can't afford it. Unexpectedly, Arthur surprises them with a generous gift.",
The King of Queens,9,1998–2007,1,16,S'ain't Valentine's,8-Feb-1999,St. Valentine's Day,https://www.imdb.com/title/tt0620143/?ref_=ttep_ep16,"Veronica throws a surprise party for Spence, interrupting Doug's romantic plans with Carrie. Meanwhile, Arthur meets a woman at a Senior Center dance.",
The King of Queens,9,1998–2007,2,10,Roamin' Holiday,22-Nov-1999,Thanksgiving,https://www.imdb.com/title/tt0620140/?ref_=ttep_ep10,"Doug wants to spend a quiet Thanksgiving with Carrie but when her friends want to stay for the weekend, he convinces Spence to move out and stay with them until he finds a place of his own.",
The King of Queens,9,1998–2007,2,12,Net Prophets,13-Dec-1999,Christmas,https://www.imdb.com/title/tt0765908/?ref_=ttep_ep12,"Doug and Carrie invest in stock for Christmas, but it causes them more stress than joy. Meanwhile, Arthur wants to go all out with Christmas decorations.",
The King of Queens,9,1998–2007,2,17,Meet By-Product,14-Feb-2000,St. Valentine's Day,https://www.imdb.com/title/tt0620108/?ref_=ttep_ep17,"On Valentine's Day, Doug and Carrie reflect on how they initially didn't hit it off when they first met.",
The King of Queens,9,1998–2007,3,8,Dark Meet,20-Nov-2000,Thanksgiving,https://www.imdb.com/title/tt0620046/?ref_=ttep_ep8,"Doug, Carrie, and Arthur reminisce about their first Thanksgiving together with Arthur's second wife, Lily.",
The King of Queens,9,1998–2007,3,11,Better Camera,11-Dec-2000,Christmas,https://www.imdb.com/title/tt0620028/?ref_=ttep_ep11,"During the Christmas season, the Heffernans discover that their new neighbor is Lou Ferrigno.",
The King of Queens,9,1998–2007,4,6,Ticker Treat,29-Oct-2001,Halloween,https://www.imdb.com/title/tt0620170/?ref_=ttep_ep6,Doug accidentally causes Arthur to have a minor heart attack on Halloween.,
The King of Queens,9,1998–2007,5,10,Loaner Car,25-Nov-2002,Thanksgiving,https://www.imdb.com/title/tt0620101/?ref_=ttep_ep10,"Deacon wants to give his kids a great Thanksgiving, but he can't do it alone. Doug offers to lend Carrie's help, but Deacon quickly discovers that she's more than he bargained for.",
The King of Queens,9,1998–2007,5,11,Mentalo Case,16-Dec-2002,Christmas,https://www.imdb.com/title/tt0620109/?ref_=ttep_ep11,The approaching Christmas brings about confusion over gift-giving and what each person will receive.,
The King of Queens,9,1998–2007,5,15,Animal Attraction,10-Feb-2003,St. Valentine's Day,https://www.imdb.com/title/tt0620017/?ref_=ttep_ep15,"On Valentine's Day, Doug's plans with Carrie are ruined when he and Deacon have to make an unexpected trip to deliver two penguins to Albany.",
The King of Queens,9,1998–2007,6,9,"Thanks, Man",26-Nov-2003,Thanksgiving,https://www.imdb.com/title/tt0620167/?ref_=ttep_ep9,"On Thanksgiving, a man with a broken-down car asks to use Doug's phone. Carrie is suspicious of him.",
The King of Queens,9,1998–2007,6,11,Santa Claustrophobia,17-Dec-2003,Christmas,https://www.imdb.com/title/tt0620146/?ref_=ttep_ep11,"Carrie takes a temporary job at IPS, leading Doug to feel like she's always around him. Meanwhile, Arthur wants a family Christmas photo and is willing to include anyone in it.",
The King of Queens,9,1998–2007,7,7,Silent Mite,15-Dec-2004,Christmas,https://www.imdb.com/title/tt0620153/?ref_=ttep_ep7,Doug thinks someone of small stature stole his wallet.,
Last Man Standing,9,2011–2021,1,4,Last Halloween Standing,25-Oct-2011,Halloween,https://www.imdb.com/title/tt2065449/?ref_=ttep_ep4,"Mike feels let down when his daughters aren't into Halloween anymore. He sneaks his grandson Boyd out to go trick or treating, but his daughter Kristin is against it.",
Last Man Standing,9,2011–2021,1,10,Last Christmas Standing,6-Dec-2011,Christmas,https://www.imdb.com/title/tt2119136/?ref_=ttep_ep10,"Ryan's unexpected return to town dampens Mike's Christmas spirit while causing confusion for Kristin and Kyle. At the same time, Mandy tries to unionize other elves as an elf at Outdoor Man, where Ed hired her.",
Last Man Standing,9,2011–2021,2,7,Putting a Hit on Christmas,14-Dec-2012,Christmas,https://www.imdb.com/title/tt2550248/?ref_=ttep_ep7,"Mike wants to surprise Vanessa with a stress-free Christmas by taking their family on a holiday trip, but Ed accidentally shoots a bald eagle while hunting for a turkey.",
Last Man Standing,9,2011–2021,3,5,Haunted House,18-Oct-2013,Halloween,https://www.imdb.com/title/tt3220458/?ref_=ttep_ep5,"Vanessa runs the Halloween Haunted House at Boyd's school but it ends up being too scary for him. Meanwhile, Mandy hurts Eve's feelings by telling her she's not popular.",
Last Man Standing,9,2011–2021,3,9,Thanksgiving,22-Nov-2013,Thanksgiving,https://www.imdb.com/title/tt3220468/?ref_=ttep_ep9,"Bud shocks the Baxters on Thanksgiving by revealing his plan to open a recreational marijuana store, leaving Mike torn between supporting his father and the values he wants to instill in his family.",
Last Man Standing,9,2011–2021,3,11,Elfie,13-Dec-2013,Christmas,https://www.imdb.com/title/tt3360260/?ref_=ttep_ep11,"Mandy surprises the housekeeper for Christmas, while Ryan considers spoiling the magic of the season for Boyd, but Mike thinks otherwise.",
Last Man Standing,9,2011–2021,3,15,Tasers,31-Jan-2014,St. Valentine's Day,https://www.imdb.com/title/tt3495488/?ref_=ttep_ep15,"Vanessa receives a bouquet of roses on Valentine's Day, but she knows they're not from Mike since he doesn't believe in giving flowers on a holiday created by Hallmark.",
Last Man Standing,9,2011–2021,4,11,Wedding Planning,12-Dec-2014,Christmas,https://www.imdb.com/title/tt4265180/?ref_=ttep_ep11,"Mike and Vanessa offer to give Kristin and Ryan a generous wedding present, but there's a catch. Meanwhile, Kyle asks Ed to teach him how to play poker.",
Last Man Standing,9,2011–2021,5,6,Halloween,30-Oct-2015,Halloween,https://www.imdb.com/title/tt5151770/?ref_=ttep_ep6,"Mike and Chuck skip giving out Halloween candy to watch football, prompting a prank war with Vanessa and Carol. Kyle dresses up like Ed at Outdoor Man, but Ed feels insulted by the impersonations.",
Last Man Standing,9,2011–2021,5,9,The Gratitude List,20-Nov-2015,Thanksgiving,https://www.imdb.com/title/tt5197846/?ref_=ttep_ep9,Vanessa is disappointed when Eve bypasses one of their holiday traditions on Thanksgiving. Kristin discovers that Mandy is lying about where she and Kyle will spend Thanksgiving.,
Last Man Standing,9,2011–2021,5,11,Gift of the Wise Man,11-Dec-2015,Christmas,https://www.imdb.com/title/tt5200572/?ref_=ttep_ep11,"Mike challenges his family to do a good deed for Vanessa during Christmas, while Chuck becomes Outdoor Man's Santa.",
Last Man Standing,9,2011–2021,6,5,Trick or Treat,21-Oct-2016,Halloween,https://www.imdb.com/title/tt6117816/?ref_=ttep_ep5,"The family plans their Halloween party, but Mike is unhappy with the holiday and picks a theme where they dress up as each other. Bickering ensues, but they come together to support Vanessa, who has just been laid off.",
Last Man Standing,9,2011–2021,6,11,My Name Is Rob,16-Dec-2016,Christmas,https://www.imdb.com/title/tt6302188/?ref_=ttep_ep11,Eve brings her new boyfriend to the Baxter family Christmas dinner.,
Last Man Standing,9,2011–2021,7,4,Bride of Prankenstein,19-Oct-2018,Halloween,https://www.imdb.com/title/tt9081548/?ref_=ttep_ep4,"On Halloween, Mike and Chuck are installing a security system at Outdoor Man when they decide to prank Joe. Meanwhile, Mandy, Kyle, Kristin, and Ryan organize a seance to communicate with the supernatural.",
Last Man Standing,9,2011–2021,7,9,The Gift of the Mike Guy,14-Dec-2018,Christmas,https://www.imdb.com/title/tt9154346/?ref_=ttep_ep9,"Mike searches for a meaningful Christmas gift for Ed, while Eve visits home and Vanessa reminds the family about the value of their holiday traditions.",
Last Man Standing,9,2011–2021,7,13,The Best Man,15-Feb-2019,St. Valentine's Day,https://www.imdb.com/title/tt15145050/?ref_=ttep_ep13,Mike is torn between his desire to officiate Chuck and Carol's wedding vow renewal for their 25th anniversary and his wish to be Chuck's best man.,
Laverne & Shirley,8,1976–1983,2,10,Oh Hear the Angels' Voices,21-Dec-1976,Christmas,https://www.imdb.com/title/tt0629000/?ref_=ttep_ep10,"Laverne, Shirley, and their group of friends perform at a Christmas party for patients in the hospital.",
Laverne & Shirley,8,1976–1983,3,12,New Year's Eve 1959,27-Dec-1977,New Year,https://www.imdb.com/title/tt0629064/?ref_=ttep_ep12,"On New Year's Eve 1959, Laverne's date cancels, Shirley is sick, and Lenny and Squiggy have a plan for midnight. Will the night end in tears or cheers for Laverne?",
Laverne & Shirley,8,1976–1983,4,14,O Come All Ye Bums,19-Dec-1978,Christmas,https://www.imdb.com/title/tt0629068/?ref_=ttep_ep14,The girls and their friends help Frank keep the holiday spirit alive for the less fortunate after he has to cancel his yearly gathering for the homeless and poor.,
Less Than Perfect,4,2002–2006,1,10,One Office Party Too Many,10-Dec-2002,Christmas,https://www.imdb.com/title/tt0630736/?ref_=ttep_ep10,"At the Christmas party, everyone comes with a plan but ends up unable to carry it out.",
Less Than Perfect,4,2002–2006,1,15,Valentine's Day,11-Feb-2003,St. Valentine's Day,https://www.imdb.com/title/tt0630759/?ref_=ttep_ep15,Claude has phone sex on Will's phone; Lydia has a secret admirer; Owen's crush only wants him to father her child.,
Less Than Perfect,4,2002–2006,2,9,Claude's Alternative Thanksgiving,25-Nov-2003,Thanksgiving,https://www.imdb.com/title/tt0630712/?ref_=ttep_ep9,"Owen's two lesbian moms come to visit for Thanksgiving and think Owen is gay. Owen asks his friends to play along, including Carl posing as his lover. Lydia and Kipp get invited to Will's party.",
Less Than Perfect,4,2002–2006,2,12,Santa Claude,16-Dec-2003,Christmas,https://www.imdb.com/title/tt0630745/?ref_=ttep_ep12,Claude handles all of Will's Christmas gift shopping for his staff and girlfriend.,
Less Than Perfect,4,2002–2006,3,5,"Knock, Knock, Who's Dead?",29-Oct-2004,Halloween,https://www.imdb.com/title/tt0630730/?ref_=ttep_ep5,"Claude tries to return Mr. Henry's belongings to his family. Ramona wants his office, but Owen scares her away with special effects. Lydia and Jeb argue over their Halloween costumes.",
Less Than Perfect,4,2002–2006,3,9,Mom's the Word,26-Nov-2004,Thanksgiving,https://www.imdb.com/title/tt0630733/?ref_=ttep_ep9,"Owen's moms visit GNB for Thanksgiving, Judith encourages Carl and Ramona's bad habits. Claude worries about losing her job and Lydia has a bad Thanksgiving with Jeb's family.",
Less Than Perfect,4,2002–2006,3,11,Claude's 15 Minutes of Christmas,17-Dec-2004,Christmas,https://www.imdb.com/title/tt0767041/?ref_=ttep_ep11,"Claude faces challenges while organizing the GNB holiday greeting, Lydia refuses to rearrange her holiday plans, and Kipp deals with relationship turbulence during the holidays.",
Living Single,5,1993–1998,1,15,Living Kringle,19-Dec-1993,Christmas,https://www.imdb.com/title/tt0634060/?ref_=ttep_ep15,"Synclaire's friends are lacking enthusiasm for Christmas, which makes her sad. Despite this, she makes an effort to inspire everyone and get them into the holiday spirit.",
Living Single,5,1993–1998,1,19,Mystery Date,13-Feb-1994,St. Valentine's Day,https://www.imdb.com/title/tt0634076/?ref_=ttep_ep19,Overton and Synclaire's relationship is strained by bad advice from friends and competition from other suitors. Kyle throws a party to bring them back together and let Hamilton choose between the ladies.,
Living Single,5,1993–1998,2,8,Trick or Trust,27-Oct-1994,Halloween,https://www.imdb.com/title/tt0634121/?ref_=ttep_ep8,Gang fails to scare Maxine on Halloween.,
Living Single,5,1993–1998,2,12,Thanks for Giving,24-Nov-1994,Thanksgiving,https://www.imdb.com/title/tt0634100/?ref_=ttep_ep12,The gang is getting ready for Thanksgiving when Scooter tells Khadijah that he needs to talk to her about something important. She assumes he is going to propose to her.,
Living Single,5,1993–1998,3,13,"Let It Snow, Let It Snow, Let It Snow... Dammit",14-Dec-1995,Christmas,https://www.imdb.com/title/tt0634058/?ref_=ttep_ep13,"The group goes on a Christmas trip to the mountains, but Overton is unhappy when a ranger won't allow him to continue his family's holiday traditions.",
Living Single,5,1993–1998,4,12,Doctor in the House,19-Dec-1996,Christmas,https://www.imdb.com/title/tt0634034/?ref_=ttep_ep12,"Guests insult Khadijah at an awards banquet, while Regine tries to impress them to snag a rich man. Max overspends on herself and gives lousy gifts to others.",
My Two Dads,3,1987–1990,1,11,Tis the Season,20-Dec-1987,Christmas,https://www.imdb.com/title/tt0655159/?ref_=ttep_ep11,"Michael and Joey use their creativity to lift Nicole's spirits during Christmas, as she struggles with missing her mother.",
My Two Dads,3,1987–1990,3,10,Thanks for the Memories,22-Nov-1989,Thanksgiving,https://www.imdb.com/title/tt0786830/?ref_=ttep_ep10,"Joey and Michael get stuck in an elevator and reminisce about their past, while Nicole, Margaret, and Shelby struggle to wait for them to be rescued before eating dinner.",
My Two Dads,3,1987–1990,3,12,I'm Dreaming of a Holiday Episode,20-Dec-1989,Christmas,https://www.imdb.com/title/tt0786827/?ref_=ttep_ep12,"Joey and Michael bicker as Christmas begins, but they imagine alternate futures where everyone is much older, except the judge who remains the same age.",
Murphy Brown,11,1988–2018,1,5,Murphy's Pony,11-Dec-1988,Christmas,https://www.imdb.com/title/tt0653828/?ref_=ttep_ep5,Murphy is irritated when three children show up at FYI two days before Christmas with a note from their mother saying she can no longer care for them and thinks Murphy would make a good mother.,
Murphy Brown,11,1988–2018,1,12,Why Do Fools Fall in Love?,13-Feb-1989,St. Valentine's Day,https://www.imdb.com/title/tt0653949/?ref_=ttep_ep12,"Frank and Murphy set each other up on blind dates, while Miles copes with his recent breakup with Jackie and Jim is pursued by an attractive woman. Phil's marriage issues are also revealed.",
Murphy Brown,11,1988–2018,2,14,What Are You Doing New Year's Eve?,1-Jan-1990,New Year,https://www.imdb.com/title/tt0653943/?ref_=ttep_ep14,"As New Year's Eve approaches, the gang reminisces about Murphy's past before sobriety, while Corky plans a party. Meanwhile, Murphy is home alone and struggles with the decision of whether or not to drink again.",
Murphy Brown,11,1988–2018,3,11,"Jingle Hell, Jingle Hell, Jingle All the Way",17-Dec-1990,Christmas,https://www.imdb.com/title/tt0653803/?ref_=ttep_ep111,"Murphy suggests her coworkers donate to charity instead of exchanging Christmas gifts, but she secretly buys presents anyway causing her coworkers to frantically purchase items at the last minute.",
Murphy Brown,11,1988–2018,4,11,Mission Control,25-Nov-1991,Thanksgiving,https://www.imdb.com/title/tt0653820/?ref_=ttep_ep11,Murphy and her friends volunteer at a homeless shelter on Thanksgiving.,
Murphy Brown,11,1988–2018,5,12,I'm Dreaming of a Brown Christmas,14-Dec-1992,Christmas,https://www.imdb.com/title/tt0653794/?ref_=ttep_ep12,"Murphy plans to have a perfect Christmas with her son and carry out every tradition, but the arrival of her father and Aunt Brooke, who have a long-standing feud, causes chaos.",
Murphy Brown,11,1988–2018,7,12,Brown in Toyland,12-Dec-1994,Christmas,https://www.imdb.com/title/tt0653742/?ref_=ttep_ep12,Murphy goes to great lengths to find a rare toy on Avery's Christmas wish list to make his holiday memorable.,
Murphy Brown,11,1988–2018,8,15,Old Flames,5-Feb-1996,St. Valentine's Day,https://www.imdb.com/title/tt0653840/?ref_=ttep_ep15,Murphy has a nightmare where she is put on trial for how she treated her ex-lovers.,
Murphy Brown,11,1988–2018,11,9,Thanksgiving and Taking,22-Nov-2018,Thanksgiving,https://www.imdb.com/title/tt9262024/?ref_=ttep_ep9,Murphy's Thanksgiving dinner guests are apprehensive about what to expect.,
Murphy Brown,11,1988–2018,11,13,Happy New Year,20-Dec-2018,New Year,https://www.imdb.com/title/tt9352508/?ref_=ttep_ep13,The gang attempts to divert Murphy's attention from worrying about Avery's assignment in Kabul by inviting her to attend the 100th anniversary New Year's Eve celebration at Phil's Bar.,
Modern Family,11,2009–2020,1,10,Undeck the Halls,9-Dec-2009,Christmas,https://www.imdb.com/title/tt1536241/?ref_=ttep_ep10,"Phil and Claire cancel Christmas for their kids until they confess to their wrongdoings. Jay doesn't want to celebrate Gloria and Manny's holiday traditions, while Mitchell and Cameron take Lily to meet Santa.",
